<?xml version="1.0" encoding="utf-8" standalone="yes"?>
<treeVectorFile xmlns:xsi="http://www.w3.org/2001/XMLSchema-instance" xmlns="http://www.openda.org" xsi:schemaLocation="http://www.openda.org D:\sluis_pa\Documents\WORK\Export%20files\rtc\treeVector.xsd">
  <treeVector>
    <treeVectorLeaf id="[Output]Maeslant_drempel/Crest width (s)">
      <vector>360</vector>
    </treeVectorLeaf>
    <treeVectorLeaf id="[Output]Maeslant_schuif/Crest width (s)">
      <vector>360</vector>
    </treeVectorLeaf>
    <treeVectorLeaf id="[Output]Maeslant_schuif/Gate lower edge level (s)">
      <vector>-17</vector>
    </treeVectorLeaf>
    <treeVectorLeaf id="[Output]Maeslant_over/Crest level (s)">
      <vector>2</vector>
    </treeVectorLeaf>
    <treeVectorLeaf id="[Output]Maeslant_over/Crest width (s)">
      <vector>0</vector>
    </treeVectorLeaf>
    <treeVectorLeaf id="[Output]Hartel_breed/Gate lower edge level (s)">
      <vector>13.5</vector>
    </treeVectorLeaf>
    <treeVectorLeaf id="[Output]Hartel_smal/Gate lower edge level (s)">
      <vector>13.5</vector>
    </treeVectorLeaf>
    <treeVectorLeaf id="[Output]Hartel_breed_ovl/Crest level (s)">
      <vector>23</vector>
    </treeVectorLeaf>
    <treeVectorLeaf id="[Output]Hartel_smal_ovl/Crest level (s)">
      <vector>23</vector>
    </treeVectorLeaf>
    <treeVectorLeaf id="[Output]HolIJsselkering/Gate lower edge level (s)">
      <vector>12.100000000000001</vector>
    </treeVectorLeaf>
    <treeVectorLeaf id="[Output]Volkerak_over/Crest level (s)">
      <vector>3.5</vector>
    </treeVectorLeaf>
    <treeVectorLeaf id="[Output]Volkerak_schuiven/Gate lower edge level (s)">
      <vector>-4.25</vector>
    </treeVectorLeaf>
    <treeVectorLeaf id="[Output]Haringvliet1/Gate lower edge level (s)">
      <vector>-5.5</vector>
    </treeVectorLeaf>
    <treeVectorLeaf id="[Output]Haringvliet2/Gate lower edge level (s)">
      <vector>-5.5</vector>
    </treeVectorLeaf>
    <treeVectorLeaf id="[Output]Haringvliet3/Gate lower edge level (s)">
      <vector>-5.5</vector>
    </treeVectorLeaf>
    <treeVectorLeaf id="[Output]Haringvliet4/Gate lower edge level (s)">
      <vector>-5.5</vector>
    </treeVectorLeaf>
    <treeVectorLeaf id="[Output]Haringvliet5/Gate lower edge level (s)">
      <vector>-5.5</vector>
    </treeVectorLeaf>
    <treeVectorLeaf id="[Output]Haringvliet6/Gate lower edge level (s)">
      <vector>-5.5</vector>
    </treeVectorLeaf>
    <treeVectorLeaf id="[Output]Haringvliet7/Gate lower edge level (s)">
      <vector>-5.5</vector>
    </treeVectorLeaf>
    <treeVectorLeaf id="[Output]Haringvliet8/Gate lower edge level (s)">
      <vector>-5.5</vector>
    </treeVectorLeaf>
    <treeVectorLeaf id="[Output]Haringvliet9/Gate lower edge level (s)">
      <vector>-5.5</vector>
    </treeVectorLeaf>
    <treeVectorLeaf id="[Output]Haringvliet10/Gate lower edge level (s)">
      <vector>-5.5</vector>
    </treeVectorLeaf>
    <treeVectorLeaf id="[Output]Haringvliet11/Gate lower edge level (s)">
      <vector>-5.5</vector>
    </treeVectorLeaf>
    <treeVectorLeaf id="[Output]Haringvliet12/Gate lower edge level (s)">
      <vector>-5.5</vector>
    </treeVectorLeaf>
    <treeVectorLeaf id="[Output]Haringvliet13/Gate lower edge level (s)">
      <vector>-5.5</vector>
    </treeVectorLeaf>
    <treeVectorLeaf id="[Output]Haringvliet14/Gate lower edge level (s)">
      <vector>-5.5</vector>
    </treeVectorLeaf>
    <treeVectorLeaf id="[Output]Haringvliet15/Gate lower edge level (s)">
      <vector>-5.5</vector>
    </treeVectorLeaf>
    <treeVectorLeaf id="[Output]Haringvliet16/Gate lower edge level (s)">
      <vector>-5.5</vector>
    </treeVectorLeaf>
    <treeVectorLeaf id="[Output]Haringvliet17/Gate lower edge level (s)">
      <vector>-5.5</vector>
    </treeVectorLeaf>
    <treeVectorLeaf id="[Output]Kromme Nolkering/Gate lower edge level (s)">
      <vector>11.1</vector>
    </treeVectorLeaf>
    <treeVectorLeaf id="[Output]zwd_BathseSpuisl/Gate lower edge level (s)">
      <vector>-4.25</vector>
    </treeVectorLeaf>
  </treeVector>
</treeVectorFile>