<?xml version="1.0" encoding="UTF-8"?>
<treeVectorFile xmlns:xsi="http://www.w3.org/2001/XMLSchema-instance" xmlns="http://www.openda.org" xsi:schemaLocation="http://www.openda.org ../../../xsd/treeVector.xsd">
  <treeVector>
    <treeVectorLeaf id="[Input]ObservationPoint01/water_level">
      <vector>0  0 0 </vector>
    </treeVectorLeaf>
    <treeVectorLeaf id="Control Group 1/rule01">
      <vector>0  0 0 </vector>
    </treeVectorLeaf>
    <treeVectorLeaf id="Control Group 2/rule01">
      <vector>0  0 0 </vector>
    </treeVectorLeaf>
    <treeVectorLeaf id="[Output]structure01/CrestLevel">
      <vector>NaN  NaN NaN </vector>
    </treeVectorLeaf>
    <treeVectorLeaf id="[Status]Control Group 1/condition01">
      <vector>1  1 1 </vector>
    </treeVectorLeaf>
    <treeVectorLeaf id="[Output]structure02/CrestLevel">
      <vector>NaN  NaN NaN </vector>
    </treeVectorLeaf>
    <treeVectorLeaf id="[Status]Control Group 2/condition01">
      <vector>1  1 1 </vector>
    </treeVectorLeaf>
  </treeVector>
</treeVectorFile>
