<?xml version="1.0" encoding="utf-8" standalone="yes"?>
<treeVectorFile xmlns:xsi="http://www.w3.org/2001/XMLSchema-instance" xmlns="http://www.openda.org" xsi:schemaLocation="http://www.openda.org C:\Users\veen_jn\Desktop\AcceptanceModels\c01_sobek-rijn-j17_5-v1\sobek-rijn-j17_5-v1\dimr_expected\rtc\treeVector.xsd">
  <treeVector>
    <treeVectorLeaf id="output_ST_Driel_zom_Crest level (s)">
      <vector>1.7</vector>
    </treeVectorLeaf>
    <treeVectorLeaf id="output_ST_Driel_zom_Crest width (s)">
      <vector>96</vector>
    </treeVectorLeaf>
    <treeVectorLeaf id="output_ST_Amerongen_zom_Crest level (s)">
      <vector>-2</vector>
    </treeVectorLeaf>
    <treeVectorLeaf id="output_ST_Amerongen_zom_Crest width (s)">
      <vector>96</vector>
    </treeVectorLeaf>
    <treeVectorLeaf id="output_ST_Hagestein_zom_Crest level (s)">
      <vector>-4.55</vector>
    </treeVectorLeaf>
    <treeVectorLeaf id="output_ST_Hagestein_zom_Crest width (s)">
      <vector>96</vector>
    </treeVectorLeaf>
    <treeVectorLeaf id="output_Sluis_Marijke_Gate lower edge level (s)">
      <vector>-2</vector>
    </treeVectorLeaf>
    <treeVectorLeaf id="output_Sluis_Bernhard_Gate lower edge level (s)">
      <vector>-2</vector>
    </treeVectorLeaf>
    <treeVectorLeaf id="output_ST_Driel_oml_Crest level (s)">
      <vector>3.2</vector>
    </treeVectorLeaf>
    <treeVectorLeaf id="output_ST_Amerongen_oml_Crest level (s)">
      <vector>-1</vector>
    </treeVectorLeaf>
    <treeVectorLeaf id="output_ST_Hagestein_oml_Crest level (s)">
      <vector>-3.5</vector>
    </treeVectorLeaf>
    <treeVectorLeaf id="output_Blok1_Vees_wap_Crest level (s)">
      <vector>5.65</vector>
    </treeVectorLeaf>
    <treeVectorLeaf id="output_VeesWap1_onttrek_Actual discharge (l)">
      <vector>-100</vector>
    </treeVectorLeaf>
    <treeVectorLeaf id="output_Blok2_Vees_wap_Crest level (s)">
      <vector>5.65</vector>
    </treeVectorLeaf>
    <treeVectorLeaf id="output_Blok3_Vees_wap_Crest level (s)">
      <vector>5.65</vector>
    </treeVectorLeaf>
    <treeVectorLeaf id="output_Blok4_Vees_wap_Crest level (s)">
      <vector>5.65</vector>
    </treeVectorLeaf>
  </treeVector>
</treeVectorFile>