<?xml version="1.0" encoding="utf-8" standalone="yes"?>
<treeVectorFile xmlns:xsi="http://www.w3.org/2001/XMLSchema-instance" xmlns="http://www.openda.org" xsi:schemaLocation="http://www.openda.org F:\checkouts\svn\DSCTestbench\trunk\cases\e105_dflowfm-drtc\f01_general\c072_generalstructure_lowering_open_door\e105-f01-c072.dsproj_data\Integrated_Model_output\rtc\treeVector.xsd">
  <treeVector>
    <treeVectorLeaf id="[Output]Maeslantkering/GateLowerEdgeLevel">
      <vector>NaN</vector>
    </treeVectorLeaf>
    <treeVectorLeaf id="[Output]Maeslantkering/GateOpeningWidth">
      <vector>NaN</vector>
    </treeVectorLeaf>
    <treeVectorLeaf id="[Output]Maeslantkering/CrestLevel">
      <vector>NaN</vector>
    </treeVectorLeaf>
  </treeVector>
</treeVectorFile>